{
  "change_sha256": null,
  "family_id": "dev_status_fallback",
  "fields_sha256": "1ed257307aa063d8a83d8fc20945227e4621a5ca7261477cf23188c5541333f1",
  "generator_sha256": "4438bb3a481ca5e88d0cba7451e9de4c4a6d613686c67759043a40aff14278a8",
  "manifest_version": 1,
  "oracle_source_sha256": "4c23d24d22e8fbd3fd09fc4df4ad1f687dfe9fb8e5c20f3237e0f1ea738f9304",
  "original_sha256": "4c23d24d22e8fbd3fd09fc4df4ad1f687dfe9fb8e5c20f3237e0f1ea738f9304",
  "panel": "unchanged",
  "program_id": "status-fallback-04",
  "recipe_sha256": "80c490f6b579ed0af031e2528f370a6cb86d8adf90c29d22c9c5663cd4a27e36",
  "split": "dev",
  "task_id": "status-fallback-04-original"
}
