{
  "change_sha256": "ae4d7bfc53a5a2327921c90b29cd53b2777a4731a40b789ab121d0c2354649cd",
  "family_id": "dev_decimal_chain",
  "fields_sha256": "bd14292748699284b832d2ed786fc6e4e7405b28cfb32761ff3b4fe3c888c8c7",
  "generator_sha256": "4438bb3a481ca5e88d0cba7451e9de4c4a6d613686c67759043a40aff14278a8",
  "manifest_version": 1,
  "oracle_source_sha256": "ed59e9538258a8fb375d281e7830aec22a5696be6c6d172772e0984b46b8d86b",
  "original_sha256": "0539e3c8c0513c04697b00bae153e416c80a8159898373b8ddd20c927c20b59c",
  "panel": "change",
  "program_id": "fee-chain-02",
  "recipe_sha256": "14c270e847c9928008a436a0c029a2782068c21155699a07e950cfe98896a30e",
  "split": "dev",
  "task_id": "fee-chain-02-change"
}
